,Product Link,Product description
127,https://www.asos.com/asos-design/asos-design-flare-jeans-with-spilt-hems-in-ecru/prd/204375328?clr=ecru&colourWayId=204375329&cid=6993,ASOS DESIGN flare jeans with spilt hems in ecru 
128,https://www.asos.com/boss-athleisure/boss-green-tee-4-t-shirt-in-white-with-circle-logo/prd/204317696?clr=white&colourWayId=204317767&cid=6993,BOSS Green Tee 4 t-shirt in white with circle logo
129,https://www.asos.com/boss-athleisure/boss-green-tee-2-logo-t-shirt-in-white/prd/204317464?clr=white&colourWayId=204317497&cid=6993,BOSS Green Tee 2 logo t-shirt in white
130,https://www.asos.com/asos-design/asos-design-relaxed-shirt-in-large-hawaiian-print/prd/204631581?clr=beige&colourWayId=204631593&cid=6993,ASOS DESIGN relaxed shirt in large Hawaiian print
131,https://www.asos.com/asos-design/asos-design-swim-shorts-in-short-length-in-blue/prd/204569528?clr=reflecting-blue&colourWayId=204569529&cid=6993,ASOS DESIGN swim shorts in short length in blue
132,https://www.asos.com/asos-design/asos-design-boxy-oversized-linen-mix-shirt-in-floral-blanket-print/prd/204562382?clr=multi&colourWayId=204562394&cid=6993,ASOS DESIGN boxy oversized linen mix shirt in floral blanket print
133,https://www.asos.com/asos-design/asos-design-swim-shorts-in-short-length-in-khaki/prd/204555460?clr=loden-green&colourWayId=204555461&cid=6993,ASOS DESIGN swim shorts in short length in khaki
134,https://www.asos.com/river-island/river-island-red-hot-chilli-peppers-t-shirt-in-ecru/prd/204912999?clr=ecru&colourWayId=204913051&cid=6993,River Island Red Hot Chilli Peppers t-shirt in ecru
135,https://www.asos.com/jack-jones/jack-jones-originals-oversized-t-shirt-with-hamsa-hand-back-print-in-white/prd/204669181?clr=white&colourWayId=204669182&cid=6993,Jack & Jones Originals oversized t-shirt with Hamsa hand back print in white
136,https://www.asos.com/jack-jones/jack-jones-originals-ringer-t-shirt-with-chest-and-back-print-in-green/prd/204648892?clr=dark-green&colourWayId=204648900&cid=6993,Jack & Jones originals ringer t-shirt with chest and back print in green
137,https://www.asos.com/only-sons/only-sons-linen-mix-elasticated-waist-shorts-in-white/prd/204561055?clr=bright-white&colourWayId=204561056&cid=6993,Only & Sons linen mix elasticated waist shorts in white
138,https://www.asos.com/only-sons/only-sons-linen-mix-tapered-fit-trousers-in-navy/prd/204402290?clr=dark-navy&colourWayId=204402305&cid=6993,Only & Sons linen mix tapered fit trousers in navy
139,https://www.asos.com/only-sons/only-sons-linen-mix-tapered-fit-trousers-in-beige/prd/204402185?clr=silver-lining&colourWayId=204402194&cid=6993,Only & Sons linen mix tapered fit trousers in beige
140,https://www.asos.com/only-sons/only-sons-jersey-cargo-short-in-black/prd/204402016?clr=black&colourWayId=204402026&cid=6993,Only & Sons jersey cargo short in black 
141,https://www.asos.com/only-sons/only-sons-linen-mix-tapered-fit-trousers-in-black/prd/204401832?clr=black&colourWayId=204401839&cid=6993,Only & Sons linen mix tapered fit trousers in black 
142,https://www.asos.com/only-sons/only-sons-linen-mix-tapered-fit-trousers-in-white/prd/204401753?clr=bright-white&colourWayId=204401800&cid=6993,Only & Sons linen mix tapered fit trousers in white
143,https://www.asos.com/only-sons/only-sons-linen-mix-cargo-trouser-in-black/prd/204401718?clr=black&colourWayId=204401732&cid=6993,Only & Sons linen mix cargo trouser in black 
144,https://www.asos.com/asos-design/asos-design-smart-skinny-linen-mix-trousers-in-navy/prd/204185767?clr=navy&colourWayId=204185768&cid=6993,ASOS DESIGN smart skinny linen mix trousers in navy
145,https://www.asos.com/asos-design/asos-design-skinny-suit-in-toffee/grp/205147208?clr=camel&colourWayId=203921490&cid=6993#203921480,ASOS DESIGN skinny suit in toffee
146,https://www.asos.com/asos-design/asos-design-skinny-suit-in-berry/grp/205147190?clr=berry&colourWayId=203921427&cid=6993#203921403,ASOS DESIGN skinny suit in berry
147,https://www.asos.com/asos-design/asos-design-skinny-suit-in-berry/grp/205147190?clr=berry&colourWayId=203921337&cid=6993#203921303,ASOS DESIGN skinny suit in berry
148,https://www.asos.com/asos-design/asos-design-slim-suit-in-sand/grp/205147191?clr=sand&colourWayId=203921279&cid=6993#203921258,ASOS DESIGN slim suit in sand
149,https://www.asos.com/asos-design/asos-design-skinny-suit-in-sand/grp/205147193?clr=sand&colourWayId=203921233&cid=6993#203921197,ASOS DESIGN skinny suit in sand
150,https://www.asos.com/asos-design/asos-design-slim-suit-in-berry/grp/205147194?clr=berry&colourWayId=203921126&cid=6993#203921087,ASOS DESIGN slim suit in berry
151,https://www.asos.com/asos-design/asos-design-slim-suit-in-sand/grp/205147191?clr=sand&colourWayId=203921082&cid=6993#203921081,ASOS DESIGN slim suit in sand
152,https://www.asos.com/asos-design/asos-design-super-skinny-tux-jacket-in-navy/prd/203229816?clr=navy&colourWayId=203229817&cid=6993,ASOS DESIGN super skinny tux jacket in navy
153,https://www.asos.com/asos-design/asos-design-tapered-wool-mix-smart-trousers-in-charcoal-window-check/prd/202811820?clr=charcoal&colourWayId=202811823&cid=6993,ASOS DESIGN tapered wool mix smart trousers in charcoal window check
154,https://www.asos.com/volcom/volcom-gardener-t-shirt-with-back-print-in-black/prd/204736171?clr=black&colourWayId=204736172&cid=6993,Volcom gardener t-shirt with back print in black
155,https://www.asos.com/berghaus/berghaus-french-pyrenees-t-shirt-with-mountain-back-print-in-mustard/prd/204708888?clr=arrowwood&colourWayId=204708916&cid=6993,Berghaus French Pyrenees t-shirt with mountain back print in mustard
156,https://www.asos.com/asos-design/asos-design-skater-chinos-in-khaki-khaki/prd/204613672?clr=green&colourWayId=204613673&cid=6993,ASOS DESIGN skater chinos in khaki - KHAKI
157,https://www.asos.com/quiksilver/quiksilver-re-mix-volley-swim-shorts-in-multi/prd/204284264?clr=multi&colourWayId=204284268&cid=6993,Quiksilver re-mix volley swim shorts in multi
158,https://www.asos.com/berghaus/berghaus-original-heritage-front-and-back-logo-t-shirt-in-white/prd/203760733?clr=white&colourWayId=203760744&cid=6993,Berghaus Original Heritage front and back logo t-shirt in white
159,https://www.asos.com/asos-design/asos-design-oversized-shorts-in-brown-rib/prd/204805531?clr=bitter-chocolate&colourWayId=204805532&cid=6993,ASOS DESIGN oversized shorts in brown rib
160,https://www.asos.com/asos-design/asos-design-oversized-shorts-in-beige-rib/prd/204786819?clr=beige&colourWayId=204786820&cid=6993,ASOS DESIGN oversized shorts in beige rib
161,https://www.asos.com/asos-design/asos-design-co-ord-oversized-shorts-in-beige-floral-towelling/prd/204776405?clr=ecru&colourWayId=204776406&cid=6993,ASOS DESIGN co-ord oversized shorts in beige floral towelling
162,https://www.asos.com/asos-design/asos-design-co-ord-oversized-shorts-in-beige-towelling-with-collegiate-embroidery/prd/204699576?clr=tofu&colourWayId=204699578&cid=6993,ASOS DESIGN co-ord oversized shorts in beige towelling with collegiate embroidery
163,https://www.asos.com/asos-design/asos-design-co-ord-oversized-sweatshirt-in-off-white-towelling-with-back-spine-embroidery/prd/204660998?clr=coconut-milk&colourWayId=204660999&cid=6993,ASOS DESIGN co-ord oversized sweatshirt in off white towelling with back spine embroidery
164,https://www.asos.com/asos-design/asos-design-oversized-shorts-in-burgundy-with-collegiate-print/prd/204625734?clr=bossa-nova&colourWayId=204625735&cid=6993,ASOS DESIGN oversized shorts in burgundy with collegiate print
165,https://www.asos.com/the-north-face/the-north-face-nse-convin-ripstop-shorts-in-black/prd/204511943?clr=black&colourWayId=204512016&cid=6993,The North Face NSE Convin ripstop shorts in black
166,https://www.asos.com/timberland/timberland-t-shirt-in-mountain-back-print-in-red/prd/204484634?clr=mayfly&colourWayId=204484647&cid=6993,Timberland t-shirt in mountain back print in red
167,https://www.asos.com/timberland/timberland-dunstan-river-small-logo-t-shirt-in-slim-fit-light-pink/prd/204484413?clr=cameo-rose&colourWayId=204484429&cid=6993,Timberland dunstan river small logo t-shirt in slim fit light pink
168,https://www.asos.com/dickies/dickies-874-straight-fit-work-chino-trousers-in-blue/prd/204456167?clr=air-force-blue&colourWayId=204456196&cid=6993,Dickies 874 straight fit work chino trousers in blue
169,https://www.asos.com/dickies/dickies-slim-fit-chino-shorts-in-navy/prd/204455064?clr=navy&colourWayId=204455071&cid=6993,Dickies slim fit chino shorts in navy
170,https://www.asos.com/vans/vans-centre-logo-side-stripe-t-shirt-in-off-white/prd/204451884?clr=cream&colourWayId=204451927&cid=6993,Vans centre logo side stripe t-shirt in off white
171,https://www.asos.com/dickies/dickies-tallasee-short-sleeve-polo-shirt-in-black-with-contrast-tipping/prd/204435622?clr=black&colourWayId=204435650&cid=6993,Dickies Tallasee short sleeve polo shirt in black with contrast tipping
172,https://www.asos.com/adidas-originals/adidas-originals-enjoy-summer-graphic-shorts-in-purple/prd/204332574?clr=tech-purple&colourWayId=204332581&cid=6993,adidas Originals Enjoy Summer graphic shorts in purple
173,https://www.asos.com/adidas-originals/adidas-originals-enjoy-summer-large-graphic-t-shirt-in-white/prd/204332507?clr=white&colourWayId=204332510&cid=6993,adidas Originals Enjoy Summer large graphic t-shirt in white
174,https://www.asos.com/nike/nike-swoosh-back-print-t-shirt-in-black/prd/204096876?clr=black&colourWayId=204096888&cid=6993,Nike Swoosh back print t-shirt in black
175,https://www.asos.com/only-sons/only-sons-slim-fit-chino-short-in-black/prd/203793436?clr=black&colourWayId=203793440&cid=6993,Only & Sons slim fit chino short in black 
176,https://www.asos.com/polo-ralph-lauren/polo-ralph-lauren-icon-logo-pima-cotton-t-shirt-custom-fit-in-grey-marl/prd/204876439?clr=grey-marl&colourWayId=204876462&cid=6993,Polo Ralph Lauren icon logo pima cotton t-shirt custom fit in grey marl
177,https://www.asos.com/polo-ralph-lauren/polo-ralph-lauren-classic-oxford-shirt-in-red-stripe/prd/204876341?clr=red&colourWayId=204876361&cid=6993,Polo Ralph Lauren classic oxford shirt in red stripe
178,https://www.asos.com/polo-ralph-lauren/polo-ralph-lauren-slim-fit-poplin-shirt-in-purple-stripe-with-pony-logo/prd/204876253?clr=navy&colourWayId=204876270&cid=6993,Polo Ralph Lauren slim fit poplin shirt in purple stripe with pony logo
179,https://www.asos.com/polo-ralph-lauren/polo-ralph-lauren-check-jersey-shirt-with-pony-logo-in-navy/prd/204876206?clr=navy&colourWayId=204876223&cid=6993,Polo Ralph Lauren check jersey shirt with pony logo in navy
180,https://www.asos.com/polo-ralph-lauren/polo-ralph-lauren-gellar-twill-cargo-shorts-relaxed-fit-in-navy/prd/204876123?clr=navy&colourWayId=204876136&cid=6993,Polo Ralph Lauren Gellar twill cargo shorts relaxed fit in navy
181,https://www.asos.com/polo-ralph-lauren/polo-ralph-lauren-triple-player-logo-t-shirt-classic-oversized-fit-in-light-green/prd/204876107?clr=light-green&colourWayId=204876125&cid=6993,Polo Ralph Lauren triple player logo t-shirt classic oversized fit in light green
182,https://www.asos.com/polo-ralph-lauren/polo-ralph-lauren-box-logo-t-shirt-classic-oversized-fit-in-white/prd/204876031?clr=white&colourWayId=204876050&cid=6993,Polo Ralph Lauren box logo t-shirt classic oversized fit in white
183,https://www.asos.com/polo-ralph-lauren/polo-ralph-lauren-stretch-twill-cargo-trousers-slim-fit-in-khaki-tan/prd/204875962?clr=khaki-tan&colourWayId=204875975&cid=6993,Polo Ralph Lauren stretch twill cargo trousers slim fit in khaki tan
184,https://www.asos.com/polo-ralph-lauren/polo-ralph-lauren-collegiate-logo-t-shirt-classic-oversized-fit-in-off-white/prd/204875919?clr=off-white&colourWayId=204875940&cid=6993,Polo Ralph Lauren collegiate logo t-shirt classic oversized fit in off white
185,https://www.asos.com/polo-ralph-lauren/polo-ralph-lauren-collegiate-logo-t-shirt-classic-oversized-fit-in-navy/prd/204875892?clr=navy&colourWayId=204875902&cid=6993,Polo Ralph Lauren collegiate logo t-shirt classic oversized fit in navy
186,https://www.asos.com/polo-ralph-lauren/polo-ralph-lauren-multi-stripe-short-sleeve-oxford-shirt-custom-fit-in-navy-white/prd/204875849?clr=navy-white&colourWayId=204875870&cid=6993,Polo Ralph Lauren multi stripe short sleeve oxford shirt custom fit in navy/white
187,https://www.asos.com/polo-ralph-lauren/polo-ralph-lauren-icon-logo-stripe-t-shirt-custom-fit-in-navy-white/prd/204875808?clr=navy-white&colourWayId=204875828&cid=6993,Polo Ralph Lauren icon logo stripe t-shirt custom fit in navy/white
188,https://www.asos.com/polo-ralph-lauren/polo-ralph-lauren-icon-logo-stripe-pique-polo-custom-fit-in-white-multi/prd/204875770?clr=white-multi&colourWayId=204875774&cid=6993,Polo Ralph Lauren icon logo stripe pique polo custom fit in white multi
189,https://www.asos.com/polo-ralph-lauren/polo-ralph-lauren-check-jersey-shirt-with-pony-logo-in-cream/prd/204875765?clr=cream&colourWayId=204875773&cid=6993,Polo Ralph Lauren check jersey shirt with pony logo in cream
190,https://www.asos.com/asos-design/asos-design-co-ord-relaxed-t-shirt-in-brown-textured-stripe/prd/204862780?clr=brown&colourWayId=204862783&cid=6993,ASOS DESIGN co-ord relaxed t-shirt in brown textured stripe
191,https://www.asos.com/hollister/hollister-7inch-flat-front-chino-shorts-in-black/prd/204850505?clr=black&colourWayId=204850506&cid=6993,Hollister 7inch flat front chino shorts in black
192,https://www.asos.com/abercrombie-fitch/abercrombie-fitch-oversized-fit-t-shirt-with-shield-logo-in-dark-green/prd/204835852?clr=green&colourWayId=204835866&cid=6993,Abercrombie & Fitch oversized fit t-shirt with shield logo in dark green
193,https://www.asos.com/abercrombie-fitch/abercrombie-fitch-pull-on-tapered-trousers-in-washed-black/prd/204835411?clr=washed-black&colourWayId=204835427&cid=6993,Abercrombie & Fitch pull on tapered trousers in washed black
194,https://www.asos.com/asos-design/asos-design-co-ord-revere-polo-shirt-in-brown-shiny-rib/prd/204810653?clr=brown&colourWayId=204810666&cid=6993,ASOS DESIGN co-ord revere polo shirt in brown shiny rib
195,https://www.asos.com/asos-design/asos-design-vest-in-white-lace/prd/204798858?clr=white&colourWayId=204798860&cid=6993,ASOS DESIGN vest in white lace
196,https://www.asos.com/asos-design/asos-design-muscle-fit-square-neck-vest-in-beige-texture/prd/204798822?clr=beige&colourWayId=204798827&cid=6993,ASOS DESIGN muscle fit square neck vest in beige texture
197,https://www.asos.com/asos-design/asos-design-oversized-t-shirt-in-brown-with-palm-springs-back-print/prd/204791353?clr=washed-brown&colourWayId=204791355&cid=6993,ASOS DESIGN oversized t-shirt in brown with Palm Springs back print
198,https://www.asos.com/asos-design/asos-design-oversized-t-shirt-with-yungblud-front-print-in-pink/prd/204763856?clr=pink&colourWayId=204763857&cid=6993,ASOS Design oversized t-shirt with Yungblud front print in pink
199,https://www.asos.com/levis/levis-501-original-denim-shorts-in-light-blue/prd/204690747?clr=light-blue&colourWayId=204690755&cid=6993,Levi's 501 Original denim shorts in light blue
200,https://www.asos.com/asos-design/asos-daysocial-unisex-oversized-heavyweight-t-shirt-with-abstract-floral-back-print-in-black/prd/204678848?clr=black&colourWayId=204678849&cid=6993,ASOS Daysocial unisex oversized heavyweight t-shirt with abstract floral back print in black
201,https://www.asos.com/asos-design/asos-design-relaxed-t-shirt-in-white-with-floral-back-print/prd/204675850?clr=ecru&colourWayId=204675851&cid=6993,ASOS DESIGN relaxed t-shirt in white with floral back print
202,https://www.asos.com/asos-design/asos-design-double-layer-long-sleeve-t-shirt-in-beige-mesh/prd/204665143?clr=beige&colourWayId=204665144&cid=6993,ASOS DESIGN double layer long sleeve t-shirt in beige mesh
203,https://www.asos.com/polo-ralph-lauren/polo-ralph-lauren-traveler-icon-logo-seersucker-stripe-swim-shorts-in-mid-green/prd/204557521?clr=mid-green&colourWayId=204557537&cid=6993,Polo Ralph Lauren Traveler icon logo seersucker stripe swim shorts in mid green
204,https://www.asos.com/polo-ralph-lauren/polo-ralph-lauren-traveler-slim-fit-icon-logo-mid-swim-shorts-in-light-blue/prd/204557340?clr=light-blue&colourWayId=204557352&cid=6993,Polo Ralph Lauren Traveler slim fit icon logo mid swim shorts in light blue
205,https://www.asos.com/levis/levis-silvertab-loose-fit-jeans-in-light-blue-wash/prd/204418961?clr=medium-indigo&colourWayId=204418969&cid=6993,Levi's Silvertab loose fit jeans in light blue wash
206,https://www.asos.com/asos-design/asos-design-baggy-jeans-in-mid-wash-blue/prd/204310096?clr=blue&colourWayId=204310099&cid=6993,ASOS DESIGN baggy jeans in mid wash blue
207,https://www.asos.com/asos-design/asos-design-classic-rigid-jeans-in-dark-wash-blue/prd/204309917?clr=blue&colourWayId=204309919&cid=6993,ASOS DESIGN classic rigid jeans in dark wash blue
208,https://www.asos.com/polo-ralph-lauren/polo-ralph-lauren-loungewear-shorts-in-navy-with-side-text-logo/prd/204233023?clr=clancy-blue&colourWayId=204233031&cid=6993,Polo Ralph Lauren loungewear shorts in navy with side text logo
209,https://www.asos.com/selected-homme/selected-homme-washed-cotton-suit-jacket-in-dark-indigo-blue/prd/202389826?clr=indigo&colourWayId=202389829&cid=6993,Selected Homme washed cotton suit jacket in dark indigo blue
210,https://www.asos.com/asos-design/asos-design-cut-out-belted-suit-in-emerald-green-satin/grp/205137023?clr=emerald&cid=6993,ASOS DESIGN cut out belted suit in emerald green satin
211,https://www.asos.com/asos-design/asos-design-slim-wool-mix-suit-in-herringbone-in-green/grp/205137020?clr=green&cid=6993,ASOS DESIGN slim wool mix suit in herringbone in green
212,https://www.asos.com/asos-design/asos-design-slim-suit-with-cut-out-detail-in-black-and-white-stripe/grp/205137019?clr=black&cid=6993,ASOS DESIGN slim suit with cut out detail in black and white stripe
213,https://www.asos.com/asos-design/asos-design-slim-wool-mix-suit-in-herringbone-in-charcoal/grp/205137018?clr=charcoal&cid=6993,ASOS DESIGN slim wool mix suit in herringbone in charcoal
214,https://www.asos.com/asos-design/asos-design-slim-shorts-in-blue-soft-towelling/prd/204626354?clr=nautical-blue&colourWayId=204626409&cid=6993,ASOS DESIGN slim shorts in blue soft towelling
215,https://www.asos.com/asos-design/asos-design-slim-wool-mix-suit-in-herringbone-in-green/grp/205137020?clr=green&colourWayId=204608693&cid=6993#204608684,ASOS DESIGN slim wool mix suit in herringbone in green
